Question,Options,Correct Option,CourtEasy-v1 Response,Evaluation,Comments (Optional)
" Under which of the following provisions of the Code of Civil Procedure, 1908 the appellate court may remit an issue for trial to lower court?","Options:
A. Order XLI Rule 23
B. Order XLI Rule 23-A
C. Order XLI Rule 24
D. Order XLI Rule 25",D,"The provision under which the appellate court may remit an issue for trial to the lower court is Order XLI Rule 25 of the Code of Civil Procedure, 1908.

Order XLI Rule 25 specifically empowers the appellate court, if it thinks that any issue necessary for the determination of the appeal has not been tried by the lower court or has been insufficiently tried, to frame the issue and refer it for trial to the lower court. The lower court is then required to try the issue and return the evidence and its findings to the appellate court.

Here is a brief explanation of the options:

A. Order XLI Rule 23: This deals with remand of the case when the suit is disposed of on a preliminary point and the decree is reversed in appeal. The appellate court may remand the case for retrial.

B. Order XLI Rule 23-A: This allows remand in cases other than those covered by Rule 23, where the trial court has disposed of the case on merits but the appellate court considers a retrial necessary.

C. Order XLI Rule 24: This allows the appellate court to finally decide the case if the evidence on record is sufficient, without remanding or referring issues.

D. Order XLI Rule 25: This allows the appellate court to frame issues and refer them for trial to the lower court, specifically for the purpose of trying those issues and returning findings.

Therefore, the correct option is:
D. Order XLI Rule 25.",Correct,Withdrawn
" A is accused of the murder of B by beating him. Which of the following will not be considered as relevant fact forming part of the same transaction as per the Indian Evidence Act, 1872?","Options:
A. Whatever said by A or B at the time of beating.
B. Whatever done by A or B at the time of beating.
C. Whatever said by by-standers at the time of beating.
D. Whatever said by A or B a day before the day of beating.",D,"Under the Indian Evidence Act, 1872, Section 6 deals with the doctrine of ""Res Gestae""—facts which, though not in issue, are so connected with a fact in issue as to form part of the same transaction. Such facts are relevant and admissible as evidence.

Let us analyze each option:

A. Whatever said by A or B at the time of beating.  
This is relevant, as statements made by the accused or the victim during the commission of the crime form part of the same transaction (Section 6).

B. Whatever done by A or B at the time of beating.  
This is also relevant, as acts done by the accused or the victim during the occurrence are part of the same transaction (Section 6).

C. Whatever said by by-standers at the time of beating.  
Statements by by-standers at the time of the incident may also be relevant if they are part of the same transaction and contemporaneous with the act (Section 6).

D. Whatever said by A or B a day before the day of beating.  
Statements made by A or B a day before the incident are not part of the same transaction, as they are not contemporaneous with the act and do not form part of the res gestae under Section 6.

Correct Option:  
D. Whatever said by A or B a day before the day of beating.

Detailed Reason:  
Section 6 of the Indian Evidence Act, 1872, makes relevant those facts which are so connected with a fact in issue as to form part of the same transaction, whether they occurred at the same time and place or at different times and places. However, for a fact to be part of the same transaction, there must be a proximity of time, place, and continuity of action. Statements or acts made a day before the incident lack this proximity and continuity, and hence, are not considered as forming part of the same transaction.

Therefore, option D will not be considered as a relevant fact forming part of the same transaction as per the Indian Evidence Act, 1872.",Correct,
" Which of the following provisions of the Indian Evidence Act, 1872 says that the confession to a police officer shall not be proved against him?","Options:
A. Section 24
B. Section 25
C. Section 26
D. Section 27",B,"The provision of the Indian Evidence Act, 1872 that states a confession made to a police officer shall not be proved against the accused is Section 25. Section 25 specifically provides that no confession made to a police officer shall be proved as against a person accused of any offence. This is to prevent the possibility of coercion or undue influence by police officers during investigations.

Therefore, the correct option is:  
B. Section 25

Section 25 of the Indian Evidence Act, 1872 reads:  
""No confession made to a police officer shall be proved as against a person accused of any offence.""",Correct,
" Under which of the following provision of the Indian Evidence Act, 1872 dying declaration may be admitted as evidence?","Options:
A. Section 25
B. Section 29
C. Section 32
D. Section 37",C,"A dying declaration is admissible as evidence under Section 32 of the Indian Evidence Act, 1872. Section 32 deals with cases in which statements of relevant facts made by persons who cannot be called as witnesses are relevant. Specifically, Section 32(1) provides that statements made by a person as to the cause of their death, or as to any of the circumstances of the transaction which resulted in their death, are relevant in cases in which the cause of that person's death comes into question. This is commonly referred to as a ""dying declaration.""

The other options are not correct:
- Section 25 relates to confessions to police officers and makes them inadmissible.
- Section 29 deals with confessions otherwise relevant not to become irrelevant because of promise of secrecy, etc.
- Section 37 relates to relevancy of statements as to facts of public nature contained in certain acts or notifications.

Therefore, the correct option is:
C. Section 32

Section 32 of the Indian Evidence Act, 1872, is the statutory provision under which a dying declaration is admitted as evidence.",Correct,
" Which of the following is correct according to the Indian Evidence Act, 1872 pertaining to proof of contents of the documents?","Options:
A. Contents of the documents shall be proved by primary evidence.
B. Contents of the documents may be proved by secondary evidence.
C. Contents of the documents shall be proved by both primary and secondary evidence.
D. Contents of documents may be proved either by primary or by secondary evidence.",D,"The correct answer is:

D. Contents of documents may be proved either by primary or by secondary evidence.

According to the Indian Evidence Act, 1872:

- Section 61 states that the contents of documents may be proved either by primary or by secondary evidence.
- Section 62 defines primary evidence as the document itself produced for the inspection of the court.
- Section 63 defines secondary evidence as including certified copies, copies made from the original, oral accounts of the contents, etc., and such evidence is admissible in circumstances specified under Section 65.

Therefore, the law allows for the contents of documents to be proved by either primary or secondary evidence, depending on the situation and fulfillment of conditions for secondary evidence. Option D is correct.",Correct,
" Which of the following is a correct statement as per the Indian Evidence Act, 1872?","Options:
A. Leading questions may be asked in examination-in-chief.
B. Leading questions may be asked in cross-examination.
C. Leading questions may be asked in re-examination.
D. Leading questions cannot be asked in cross-examination.",B,"The correct statement as per the Indian Evidence Act, 1872 is B. Leading questions may be asked in cross-examination. Leading questions are not permitted in examination-in-chief or re-examination unless with the permission of the Court.",Correct,
" Which of the following is incorrect statement in the light of Indian Evidence Act, 1872?","Options:
A. Confession always goes against a person making it.
B. Admissions are conclusive as to the matters admitted.
C. Admissions may operate as an estoppel.
D. Confession is a statement, written or oral, which is a direct admission of guilt.",B,"The incorrect statement in the light of the Indian Evidence Act, 1872 is:

B. Admissions are conclusive as to the matters admitted.

Detailed Explanation:

A. Confession always goes against a person making it.  
This is correct. A confession, by its nature, is a statement made by an accused admitting guilt, and it is always used against the person making it.

B. Admissions are conclusive as to the matters admitted.  
This is incorrect. According to Section 31 of the Indian Evidence Act, 1872, admissions are not conclusive proof of the matters admitted, but they may operate as estoppel under certain circumstances. This means that while admissions are relevant and can be used as evidence, they are not final or binding proof and can be explained or rebutted.

C. Admissions may operate as an estoppel.  
This is correct. Section 31 of the Act states that admissions may operate as estoppel, meaning a person may be prevented from denying the truth of the admission in certain situations.

D. Confession is a statement, written or oral, which is a direct admission of guilt.  
This is correct. A confession is defined as a statement made by a person charged with a crime, admitting that they committed the offence, either in writing or orally.

Therefore, the correct answer is:  
B. Admissions are conclusive as to the matters admitted.",Correct,
" Which of the following Section of the Indian Evidence Act, 1872 is an exception to the hearsay rule?","Options:
A. Section 32(1)
B. Section 32(2)
C. Section 32(3)
D. Section 32(5)",A,"The hearsay rule generally excludes statements made outside the court from being admitted as evidence. However, Section 32 of the Indian Evidence Act, 1872 provides exceptions to this rule. Specifically, Section 32(1) is a well-known exception, which allows statements made by a person as to the cause of their death, or as to any of the circumstances of the transaction which resulted in their death, to be admissible in cases in which the cause of that person's death comes into question. These are commonly referred to as ""dying declarations.""

Therefore, the correct option is:  
A. Section 32(1)

Section 32(1) is the statutory exception to the hearsay rule under the Indian Evidence Act, 1872, as it permits the admissibility of certain statements made by persons who cannot be called as witnesses, particularly in relation to the cause of their death.",Correct,
" Which of the following is not a recognized alternate dispute resolution mechanism under the Code of Civil Procedure, 1908?","Options:
A. Arbitration
B. Conciliation
C. Lok Adalat
D. Negotiation",D,"The Code of Civil Procedure, 1908 (CPC), specifically under Section 89, recognizes certain alternate dispute resolution (ADR) mechanisms to facilitate the settlement of disputes outside the traditional court process. The recognized mechanisms under Section 89 of the CPC are:

A. Arbitration  
B. Conciliation  
C. Lok Adalat  
D. Mediation

Negotiation is not specifically mentioned as a recognized ADR mechanism under Section 89 of the CPC. While negotiation is a common method of dispute resolution, it is not formally provided for in the CPC as an ADR mechanism.

Therefore, the correct answer is:

D. Negotiation

Detailed Explanation:
- Arbitration: Recognized under Section 89(1)(a) of the CPC.
- Conciliation: Recognized under Section 89(1)(b) of the CPC.
- Lok Adalat: Recognized under Section 89(1)(c) of the CPC and also under the Legal Services Authorities Act, 1987.
- Negotiation: Not specifically recognized under Section 89 of the CPC.

Correct Option: D. Negotiation",Correct,
 Which of the following is incorrect statement with respect to Lok Adalat?,"Options:
A. No court fee is required in Lok Adalat.
B. Lok Adalat can deal with all civil & criminal matters.
C. Award of Lok Adalat is a deemed decree.
D. No appeal against the award of Lok Adalat is allowed.",B,"The incorrect statement with respect to Lok Adalat is:

B. Lok Adalat can deal with all civil & criminal matters.

Detailed Explanation:

According to the Legal Services Authorities Act, 1987:

A. No court fee is required in Lok Adalat.  
This is correct. As per Section 21 of the Act, no court fee is payable when a matter is referred to Lok Adalat, and if any court fee has already been paid, it is refunded.

B. Lok Adalat can deal with all civil & criminal matters.  
This is incorrect. Lok Adalats can deal with civil cases (including matrimonial, family, and compoundable criminal cases). However, they cannot deal with non-compoundable criminal offences. Only compoundable offences under criminal law can be settled in Lok Adalat.

C. Award of Lok Adalat is a deemed decree.  
This is correct. As per Section 21 of the Act, the award of Lok Adalat is deemed to be a decree of a civil court and is final and binding on all parties.

D. No appeal against the award of Lok Adalat is allowed.  
This is correct. The award of Lok Adalat is final and binding, and no appeal lies against it to any court.

Therefore, the correct answer is option B. Lok Adalat cannot deal with all civil and criminal matters; it is limited to civil cases and compoundable criminal cases only.",Correct,
" Which of the following is incorrect with respect to arbitration agreement as per the Arbitration and Conciliation Act, 1996?","Options:
A. Arbitration agreement may be written as well as oral.
B. Arbitration agreement may be in the form of a separate agreement.
C. Arbitration agreement may be in the form of an arbitration clause in a contract.
D. Arbitration agreement may be for all or certain disputes which may arise between the parties.",A,"Option A is incorrect.

As per the Arbitration and Conciliation Act, 1996, specifically Section 7, an arbitration agreement must be in writing. The Act does not recognize oral arbitration agreements. Section 7(3) clearly states: ""An arbitration agreement shall be in writing."" The writing requirement can be fulfilled if the agreement is contained in a document signed by the parties, or in an exchange of letters, telex, telegrams, or other means of telecommunication which provide a record of the agreement, or in an exchange of statements of claim and defence in which the existence of the agreement is alleged by one party and not denied by the other.

Options B, C, and D are correct as per the Act:
- An arbitration agreement may be in the form of a separate agreement (Section 7(2)).
- It may also be in the form of an arbitration clause in a contract (Section 7(2)).
- The agreement may relate to all or certain disputes which have arisen or may arise between the parties (Section 7(1)).

Therefore, the correct answer is:
A. Arbitration agreement may be written as well as oral. (This is incorrect as per the Arbitration and Conciliation Act, 1996.)",Incorrect,
" In which of the following circumstances an arbitrator may not be challenged as per the Arbitration and Conciliation Act, 1996?","Options:
A. When a justifiable doubt as to his independence arises.
B. When a justifiable doubt as to his impartiality arises.
C. When he possesses the qualifications agreed by the party.
D. When he becomes ineligible as per the seventh schedule of the Act.",C,"An arbitrator may be challenged under the Arbitration and Conciliation Act, 1996, if circumstances exist that give rise to justifiable doubts as to his independence or impartiality (Section 12(3)(a)), or if he does not possess the qualifications agreed to by the parties (Section 12(3)(b)), or if he becomes ineligible as per the Seventh Schedule (Section 12(5)).

However, if the arbitrator possesses the qualifications agreed by the parties, this is not a ground for challenge; rather, it is a requirement for appointment. Therefore, the correct option is:

C. When he possesses the qualifications agreed by the party.

This is not a circumstance in which an arbitrator may be challenged under the Act. The other options (A, B, and D) are valid grounds for challenging an arbitrator as per the Act.",Correct,
" When may two persons be said to be related to each other by half-blood in accordance with the Hindu Marriage Act, 1955?","Options:
A. When they are descended from a common ancestor by the same wife.
B. When they are descended from a common ancestor by different wives.
C. When they are descended from a common ancestress by different husbands.
D. When they are not descended from a common ancestor at all.",B,"Under the Hindu Marriage Act, 1955, the term ""half-blood"" is defined in Section 3(f)(ii). Two persons are said to be related to each other by half-blood when they are descended from a common ancestor but by different wives. This means that they share the same father or ancestor, but their mothers are different.

Option A is incorrect because it refers to descent from a common ancestor by the same wife, which would make them related by full blood, not half-blood.

Option B is correct because it refers to descent from a common ancestor by different wives, which is the statutory definition of half-blood.

Option C is incorrect because it refers to descent from a common ancestress by different husbands, which is not the definition of half-blood under the Act.

Option D is incorrect because if they are not descended from a common ancestor at all, there is no blood relationship.

Therefore, the correct answer is:
B. When they are descended from a common ancestor by different wives.",Correct,
" Which of the following is generally not considered as a valid condition for a Hindu marriage as per the Hindu Marriage Act, 1955?","Options:
A. The parties should not have a spouse living at the time of the marriage.
B. The parties should be within the degrees of prohibited relationship.
C. The parties should not be sapindas of each other.
D. The parties should not be suffering from epilepsy.",B,"The Hindu Marriage Act, 1955 (HMA) lays down specific conditions for a valid Hindu marriage under Section 5. Let’s examine each option in light of the statutory provisions:

A. The parties should not have a spouse living at the time of the marriage.  
This is a valid condition under Section 5(i) of the HMA, which prohibits bigamy.

B. The parties should be within the degrees of prohibited relationship.  
This is NOT a valid condition. In fact, Section 5(iv) of the HMA states that the parties should NOT be within the degrees of prohibited relationship, unless the custom or usage governing each of them permits such a marriage.

C. The parties should not be sapindas of each other.  
This is a valid condition under Section 5(v) of the HMA, which prohibits marriage between sapindas, unless permitted by custom.

D. The parties should not be suffering from epilepsy.  
This is NOT a current condition. Earlier, Section 5(ii)(c) of the HMA included epilepsy as a disqualification, but this was removed by the Marriage Laws (Amendment) Act, 1999. Now, suffering from epilepsy is not a bar to marriage under the HMA.

Therefore, the correct answer is:

D. The parties should not be suffering from epilepsy.

This is generally not considered a valid condition for a Hindu marriage as per the current provisions of the Hindu Marriage Act, 1955.",Incorrect,
" Section 13(1) of the Hindu Marriage Act, 1955 provides for the following: i. Grounds for restitution of conjugal rights ii. Grounds for judicial separation iii. Grounds for divorce","Options:
A. i & ii
B. ii & iii
C. iii & i
D. Only iii",B,"Section 13(1) of the Hindu Marriage Act, 1955, specifically provides for the grounds on which a marriage may be dissolved by a decree of divorce. It lists the various grounds on which either the husband or the wife may present a petition for divorce.

Let’s examine the options:

i. Grounds for restitution of conjugal rights – This is covered under Section 9 of the Hindu Marriage Act, not Section 13(1).
ii. Grounds for judicial separation – This is covered under Section 10 of the Act, not Section 13(1).
iii. Grounds for divorce – This is precisely what Section 13(1) deals with.

Therefore, the correct answer is:

D. Only iii.

Section 13(1) of the Hindu Marriage Act, 1955, provides only for the grounds for divorce.",Incorrect,
 What is the meaning of the batil marriage in Muslim Law?,"Options:
A. Valid marriage
B. Void marriage
C. Voidable marriage
D. Irregular marriage",B,"In Muslim Law in India, a 'batil marriage' refers to a void marriage. A void (batil) marriage is one that is unlawful in itself and has no legal effect from the very beginning. Such a marriage is considered null and void, and no rights or obligations arise from it for the parties involved. Examples include a marriage within prohibited degrees of relationship or a marriage during the existence of a valid marriage (bigamy, where not permitted).

The correct option is:  
B. Void marriage

This is supported by the principles of Muslim personal law as applied in India, where marriages are classified as valid (sahih), void (batil), and irregular (fasid). 'Batil' specifically denotes a marriage that is void ab initio and cannot be validated by subsequent acts.",Correct,
 What is 'a contract of marriage which may be dissolved by the wife under a power delegated to her' called under the Muslim Law?,"Options:
A. Talaq-us-sunnat
B. Talaq-ul-biddat
C. Talaq-i-tafweez
D. Talaq-a-hasan",C,"The contract of marriage which may be dissolved by the wife under a power delegated to her is called Talaq-i-tafweez under Muslim Law. 

Talaq-i-tafweez is a form of delegated divorce, where the husband delegates the power of pronouncing talaq to his wife, either at the time of marriage (in the nikahnama) or later. This delegation allows the wife to dissolve the marriage herself if certain conditions specified in the agreement are met. This form of talaq is recognized under Muslim personal law and is not prohibited by statutes.

Therefore, the correct option is:  
C. Talaq-i-tafweez.",Correct,
" A Hindu boy and a Hindu girl may be married under the following law: i. The Hindu Marriage Act, 1955 ii. The Special Marriage Act, 1954","Options:
A. Only i is correct.
B. Only ii is correct.
C. Both i and ii are correct.
D. Neither i nor ii is correct.",C,"A Hindu boy and a Hindu girl may be married under both the Hindu Marriage Act, 1955 (HMA) and the Special Marriage Act, 1954. 

The Hindu Marriage Act, 1955 specifically governs marriages between Hindus, including Buddhists, Jains, and Sikhs, and lays down the conditions and procedures for a valid Hindu marriage.

The Special Marriage Act, 1954 is a secular law that allows any two persons, irrespective of their religion, to marry. Hindus can also choose to marry under this Act if they wish to have a civil marriage without religious ceremonies or if they want their marriage to be governed by secular law.

Therefore, the correct answer is: Both (i) The Hindu Marriage Act, 1955 and (ii) The Special Marriage Act, 1954.",Correct,
 Through which of the following Amendment Act the rights in the coparcenary property is made available to a girl child as well?,"Options:
A. The Hindu Succession (Amendment) Act, 2002
B. The Hindu Succession (Amendment) Act, 2004
C. The Hindu Succession (Amendment) Act, 2005
D. The Hindu Succession (Amendment) Act, 2006",C,"The right of a daughter to be a coparcener in the Hindu Undivided Family (HUF) property was conferred by The Hindu Succession (Amendment) Act, 2005. This amendment inserted Section 6 in the Hindu Succession Act, 1956, granting daughters the same rights and liabilities in the coparcenary property as sons. Therefore, the correct option is:

C. The Hindu Succession (Amendment) Act, 2005

This amendment marked a significant step towards gender equality in matters of inheritance among Hindus by ensuring that daughters have equal rights in ancestral property.",Correct,
 What should be the age difference between the adoptive father and his adopted daughter for a valid adoption?,"Options:
A. 15 years
B. 18 years
C. 21 years
D. No specific age difference required.",C,"Under the Hindu Adoption and Maintenance Act, 1956, specifically Section 11(iii), if a male adopts a female child, the adoptive father must be at least 21 years older than the adopted daughter for the adoption to be valid. This statutory requirement ensures a significant age gap between the adoptive father and the adopted daughter.

Therefore, the correct option is:
C. 21 years

No other Indian adoption law prescribes a different age difference for this scenario.",Correct,
