Question,Options,Correct Option,CourtEasy-v1 Response,Evaluation,Comments (Optional)
" A person arrested by a private person for committing a non-bailable and cognizable offence shall be re-arrested by a police officer if such person comes under which of the following provision of the Code of Criminal Procedure, 1973?","Options:
A. Section 41
B. Section 41A
C. Section 42
D. Section 43",D,"The correct provision of the Criminal Procedure Code, 1973, regarding the re-arrest of a person by a police officer after being arrested by a private person for committing a non-bailable and cognizable offence is Section 43.

Section 43 of the CrPC deals with the arrest by private persons and the procedure to be followed. According to Section 43(1), any private person may arrest or cause to be arrested any person who in his view has committed a non-bailable and cognizable offence, or any proclaimed offender, and, without unnecessary delay, shall make over or cause to be made over any person so arrested to a police officer, or, in the absence of a police officer, take such person to the nearest police station.

Section 43(2) further provides that if there is reason to believe that such person comes under the provisions of Section 41 (which deals with when police may arrest without warrant), a police officer shall re-arrest him.

Therefore, the correct answer is:

D. Section 43

Section 43 specifically provides for the procedure when a private person arrests someone for a non-bailable and cognizable offence, and it mandates that the police officer shall re-arrest the person if he comes under the provisions of Section 41.",Correct,
" Under which of the following situation wife is not entitled for maintenance under Section 125 of the Code of Criminal Procedure, 1973?","Options:
A. Husband presumes that wife is living in adultery.
B. Voluntarily wife refuses to live with husband.
C. Wife living separately as husband keeps a mistress.
D. Wife is forcefully removed from the house.",B,"Under Section 125 of the Criminal Procedure Code, 1973, a wife is not entitled to maintenance in certain circumstances. The relevant statutory provisions are as follows:

Section 125(4) of the CrPC states that no wife shall be entitled to receive an allowance for maintenance from her husband under this section if she is living in adultery, or if, without any sufficient reason, she refuses to live with her husband, or if they are living separately by mutual consent.

Now, let us analyze each option:

A. Husband presumes that wife is living in adultery.  
A mere presumption by the husband is not sufficient. The law requires proof that the wife is actually living in adultery. So, this is not correct.

B. Voluntarily wife refuses to live with husband.  
If the wife refuses to live with her husband without sufficient reason, she is not entitled to maintenance under Section 125(4). This is a correct ground for denial of maintenance.

C. Wife living separately as husband keeps a mistress.  
If the husband keeps a mistress, the wife has a sufficient reason to live separately and is still entitled to maintenance.

D. Wife is forcefully rem",Incorrect,Withdrawn
" Which of the following procedure is dealt under Section 164-A of the Code of Criminal Procedure, 1973?","Options:
A. Medical examination of the victim of rape.
B. Attendance of witness by police officer.
C. Recording of confession statement.
D. Recording of first information report by police officer.",A,"Section 164-A of the Criminal Procedure Code, 1973 deals with the ""Medical examination of the victim of rape."" This section was inserted to ensure that the victim of rape is medically examined promptly and in accordance with the law, so that necessary evidence can be collected and preserved for the investigation and trial.

Section 164-A lays down the procedure for the medical examination, including who can conduct the examination (a registered medical practitioner), the time frame within which it should be done (within 24 hours of receiving information), and the requirement to forward the medical report to the investigating officer.

Therefore, the correct option is:

A. Medical examination of the victim of rape.",Correct,
" Which of the following is incorrect with respect to diary of proceedings in investigation as per the Code of Criminal Procedure, 1973?","Options:
A. The statements of witnesses recorded during investigation shall be inserted in the diary.
B. The diary shall be duly paginated.
C. The diary may be used as evidence.
D. Can be used by the police officers to refresh memory.",C,"The incorrect statement with respect to the diary of proceedings in investigation as per the Criminal Procedure Code (CrPC), 1973 is C. The diary may be used as evidence. According to the CrPC, the diary is not to be used as evidence in the case but may be used to aid the court in its inquiry or trial.",Correct,
" In which of the following cases manner of committing offence is not required to be mentioned in the charge as per the Code of Criminal Procedure, 1973?","Options:
A. A is accused of the theft of a certain article at a certain time and place.
B. A is accused of cheating B at a given time and place.
C. A is accused of disobeying a direction of the law with intent to save B from punishment.
D. A is accused of giving false evidence at a given time and place.",A,"The manner of committing the offence is not required to be mentioned in the charge in the following case: A. A is accused of the theft of a certain article at a certain time and place.According to the Code of Criminal Procedure, 1973, the charge for theft need not set out the manner in which the theft was effected.",Correct,
" Which of the following offences may be tried summarily as per the Code of Criminal Procedure, 1973?","Options:
A. Offence under Section 454 of the IPC.
B. Offence under Section 504 of the IPC.
C. Offence punishable with imprisonment for a term not exceeding two years.
D. Offence punishable with life imprisonment.",C,"Under the Code of Criminal Procedure, 1973 (CrPC), summary trials are governed by Sections 260 to 265. Section 260(1) of the CrPC specifies the types of offences that may be tried summarily by a Magistrate of the First Class. The relevant categories include:

- Offences not punishable with death, imprisonment for life, or imprisonment for a term exceeding two years.
- Certain specific offences under the Indian Penal Code (IPC), such as theft (Section 379, 380, 381), receiving or retaining stolen property (Section 411), assisting in concealment of stolen property (Section 414), and others, provided the value of the property does not exceed a specified amount.

Now, considering the options:

A. Offence under Section 454 of the IPC (Lurking house-trespass or house-breaking in order to commit offence punishable with imprisonment): This offence is punishable with imprisonment up to three years, or with fine, or with both. Since the punishment exceeds two years, it cannot be tried summarily.

B. Offence under Section 504 of the IPC (Intentional insult with intent to provoke breach of the peace): This offence is punishable with imprisonment up to two years, or with fine, or with both. This falls within the limit for summary trial.

C. Offence punishable with imprisonment for a term not exceeding two years: As per Section 260(1), such offences may be tried summarily.

D. Offence punishable with life imprisonment: Offences punishable with life imprisonment cannot be tried summarily.

Therefore, the correct options are:

B. Offence under Section 504 of the IPC, where IPC refers to Indian Penal Code;
C. Offence punishable with imprisonment for a term not exceeding two years.

Detailed reasoning: Only those offences which are not punishable with death, imprisonment for life, or imprisonment for a term exceeding two years may be tried summarily under the CrPC. Offences under Section 504 IPC and any offence punishable with imprisonment not exceeding two years satisfy this requirement. Offences under Section 454 IPC and those punishable with life imprisonment do not qualify for summary trial.",Correct,Withdrawn
" Which of the following Section of the Code of Criminal Procedure, 1973 provides for reference to High Court?","Options:
A. Section 275
B. Section 325
C. Section 383
D. Section 395",D,"Section 395 of the Code of Criminal Procedure, 1973 (CrPC) provides for reference to the High Court. This section deals with situations where a court is faced with a question as to the validity of any Act, ordinance, or regulation and feels that the question is of such a nature that it should be decided by the High Court. In such cases, the court may refer the question to the High Court for its decision.

The correct option is: D. Section 395.

Detailed Explanation:
Section 395 CrPC empowers a court to refer a case to the High Court if it involves a question regarding the validity of any law, ordinance, or regulation, and the court is of the opinion that such a question is necessary to be decided for the disposal of the case. The High Court then decides the question and sends its judgment back to the referring court, which will then dispose of the case in accordance with the High Court's decision.

The other options are not related to reference to the High Court:
- Section 275 deals with the record in warrant cases.
- Section 325 deals with the procedure when Magistrate cannot pass a sufficiently severe sentence.
- Section 383 deals with the procedure when an appellant is in jail and cannot present the appeal in person.

Therefore, the correct answer is D. Section 395.",Correct,
" A person accused of the following offence may not be granted bail under Section 438 of the Code of Criminal Procedure, 1973: i. Accused of offence under Section 376AB of the IPC. ii. Accused of offence under Section 376DA of the IPC. iii. Accused of offence under Section 376DB of the IPC.","Options:
A. i & ii
B. ii & iii
C. iii & i
D. i, ii & iii",D,"Section 438 of the Code of Criminal Procedure, 1973 (CrPC) deals with the provision of anticipatory bail. However, the proviso to Section 438(1) specifically restricts the grant of anticipatory bail to persons accused of certain offences under the Indian Penal Code (IPC).

As per the proviso to Section 438(1), anticipatory bail shall not be granted to a person accused of having committed an offence under:

- Section 376(3) of the IPC (rape of a woman under sixteen years of age),
- Section 376AB of the IPC (rape of a woman under twelve years of age),
- Section 376DA of the IPC (gang rape of a woman under sixteen years of age),
- Section 376DB of the IPC (gang rape of a woman under twelve years of age).

Therefore, a person accused of an offence under Section 376AB, Section 376DA, or Section 376DB of the IPC is not eligible to be granted anticipatory bail under Section 438 of the CrPC.

Correct option: All of the above (i, ii, and iii).",Correct,
" Which of the following act if done by any Magistrate, even in good faith without being empowered, shall vitiate the proceedings as per the Code of Criminal Procedure, 1973?","Options:
A. Tender a pardon under Section 306 of CrPC.
B. Recall a case and try it under Section 410 of the CrPC.
C. Attaches property under Section 83 of the CrPC.
D. Hold an inquest under Section 176 of the CrPC.",C,"The correct answer is:  
A. Tender a pardon under Section 306 of the CrPC (Criminal Procedure Code).

Detailed Explanation:

Section 460 and Section 461 of the Code of Criminal Procedure, 1973, deal with irregularities committed by Magistrates. Section 460 lists certain acts done by a Magistrate not empowered by law to do them, but if done in good faith, the proceedings are not vitiated. Section 461, on the other hand, lists acts which, if done by a Magistrate not empowered by law, shall vitiate the proceedings.

Section 461(g) specifically states that if any Magistrate, not being empowered by law in this behalf, tenders a pardon under Section 306, the proceedings shall be void. This means that the act of tendering a pardon under Section 306 by a Magistrate who is not empowered to do so, even if done in good faith, will vitiate the proceedings.

The other options:

- Recall a case and try it under Section 410 (Option B)
- Attach property under Section 83 (Option C)
- Hold an inquest under Section 176 (Option D)

These acts, if done by a Magistrate not empowered, are covered under Section 460, which states that such acts, if done in good faith, do not vitiate the proceedings.

Therefore, the only act among the options that will vitiate the proceedings if done by a Magistrate not empowered, even in good faith, is:

A. Tender a pardon under Section 306 of the CrPC.",Incorrect,Withdrawn
" Which of the following is material for deciding the jurisdiction of the Civil Court in the light of the Code of Civil Procedure, 1908?","Options:
A. Averments made in the plaint
B. Averments made in the written statement
C. Both (A) & (B)
D. Neither (A) nor (B)",A,"The determination of the jurisdiction of a Civil Court under the Code of Civil Procedure, 1908 (CPC), is primarily based on the averments made in the plaint. According to settled legal principles and judicial precedents, it is the statements and facts as pleaded by the plaintiff in the plaint that are material for deciding whether the court has jurisdiction to entertain the suit.

Section 9 of the CPC provides that the courts shall have jurisdiction to try all suits of a civil nature except those which are expressly or impliedly barred. The Supreme Court of India, in several cases, has clarified that the jurisdiction of the court is to be determined on the basis of the allegations made in the plaint and not on the defence taken in the written statement.

Key Case Law:
- In the case of Abdulla Bin Ali v. Galappa, AIR 1985 SC 577, the Supreme Court held that the jurisdiction of the court is to be determined on the basis of the allegations made in the plaint and not on the allegations made in the written statement.
- Similarly, in the case of Sopan Sukhdeo Sable v. Assistant Charity Commissioner, (2004) 3 SCC 137, the Supreme Court reiterated that the question of jurisdiction has to be determined on the basis of the averments made in the plaint and not on the defence taken in the written statement.

Therefore, the correct answer is:

A. Averments made in the plaint

Only the averments made in the plaint are material for deciding the jurisdiction of the Civil Court under the Code of Civil Procedure, 1908.",Correct,
" Which of the following cannot be considered as the suit of civil nature for Section 9 of the Code of Civil Procedure, 1908?","Options:
A. Suit for recovery of voluntary payments or offerings.
B. Suit for rights of franchise.
C. Suit for specific reliefs.
D. Suit relating to rights of worship.",D,"Section 9 of the Code of Civil Procedure, 1908 (CPC) provides that the courts shall have jurisdiction to try all suits of a civil nature except those which are expressly or impliedly barred.

A suit is of a ""civil nature"" if it pertains to the private rights and obligations of citizens, as opposed to criminal or political matters. Explanation I to Section 9 clarifies that a suit in which the right to property or to an office is contested is a suit of a civil nature, even if such right may depend entirely on the decision of questions as to religious rites or ceremonies.

Let us analyze each option:

A. Suit for recovery of voluntary payments or offerings:  
Such suits are not of a civil nature because voluntary offerings or payments are not legally enforceable rights. Courts do not entertain suits for recovery of voluntary offerings, as there is no legal obligation to return or pay such offerings.

B. Suit for rights of franchise:  
A suit relating to the right of franchise (such as the right to vote) is considered a suit of civil nature, as it pertains to a legal right.

C. Suit for specific reliefs:  
Suits for specific reliefs (such as injunctions, specific performance, etc.) are of a civil nature, as they relate to the enforcement of civil rights.

D. Suit relating to rights of worship:  
Suits relating to rights of worship are also of a civil nature, as recognized by Explanation I to Section 9.

Therefore, the correct answer is:

A. Suit for recovery of voluntary payments or offerings.

This cannot be considered as a suit of civil nature for the purposes of Section 9 of the CPC.",Incorrect,
" Which of the following provision of the Code of Civil Procedure, 1908 makes the doctrine of res judicata applicable in representative suits?","Options:
A. Section 11, Explanation V
B. Section 11, Explanation VI
C. Section 11, Explanation VII
D. Section 11, Explanation VIII",B,"The doctrine of res judicata is incorporated in Section 11 of the Code of Civil Procedure, 1908 (CPC). Specifically, Explanation VI to Section 11 makes the doctrine of res judicata applicable in representative suits. Explanation VI states that where persons litigate bona fide in respect of a public right or of a private right claimed in common for themselves and others, all persons interested in such right shall, for the purposes of this section, be deemed to claim under the persons so litigating. This means that a decision in a representative suit binds not only the parties to the suit but also all those who are represented.

Therefore, the correct option is:
B. Section 11, Explanation VI.",Correct,
 In which of the following situations a court will not issue summons for personal appearance to the defendant?,"Options:
A. If defendant resides within the local limit of the court's jurisdiction.
B. If defendant resides within 40 miles from the court.
C. If defendant resides 250 miles away from the court in an area having public conveyance available.
D. Woman to whom Section 132 of the Civil Procedure Code, 1908 does not apply.",C,"The correct answer is: D. Woman to whom Section 132 of the CPC does not apply.

Explanation:

Under the Civil Procedure Code, 1908 (CPC), Section 132 provides exemption to certain women from personal appearance in court. Specifically, Section 132 states that women who, according to the customs and manners of the country, ought not to be compelled to appear in public, are exempt from personal appearance in court. Therefore, if a woman does not fall under the exemption provided by Section 132 (i.e., Section 132 does not apply to her), the court can issue summons for her personal appearance.

However, the question asks in which situation the court will not issue summons for personal appearance. The only situation where the court is barred from issuing such summons is when Section 132 applies, i.e., to women who are entitled to exemption under Section 132. Since option D refers to a woman to whom Section 132 does not apply, the court can issue summons for her personal appearance.

Let’s analyze the other options:

A. If the defendant resides within the local limit of the court's jurisdiction – The court can issue summons for personal appearance.

B. If the defendant resides within 40 miles from the court – The court can issue summons for personal appearance.

C. If the defendant resides 250 miles away from the court in an area having public conveyance available – As per Order V Rule 3 of the CPC, the court may issue summons for personal appearance if public conveyance is available, even if the distance is more than 200 miles.

D. Woman to whom Section 132 of the CPC does not apply – The court can issue summons for personal appearance.

Therefore, in all the given options, the court can issue summons for personal appearance. However, if the question is asking in which situation the court will not issue summons, the correct answer would be: to a woman to whom Section 132 applies (i.e., who is entitled to exemption). Since option D is about a woman to whom Section 132 does not apply, the court can issue summons.

If the intent is to select the situation where the court will not issue summons, none of the options directly state ""a woman to whom Section 132 applies."" But based on the options given, the answer is that the court will not issue summons for personal appearance to a woman to whom Section 132 applies.

If you need to select from the given options, none of them is strictly correct as per the statute, but D is the closest in context for understanding the application of Section 132.",Incorrect,
" In which of the following situation plaintiff is precluded from bringing a fresh suit as per the Code of Civil Procedure, 1908?","Options:
A. Dismissal of suit where summons not served in consequence of plaintiff's failure to pay costs.
B. Dismissal of suit because neither party appeared.
C. Dismissal of suit because plaintiff did not appear.
D. Dismissal of suit because plaintiff did not apply for fresh summons within given time limit once it returned unserved.",C,"A plaintiff is precluded from bringing a fresh suit in certain situations as per the Code of Civil Procedure, 1908 (CPC). The relevant statutory provisions are:

1. Order II Rule 2 of CPC: If a plaintiff omits to sue in respect of, or intentionally relinquishes, any portion of his claim, he shall not afterwards sue in respect of the portion so omitted or relinquished. This means that all claims arising from the same cause of action must be included in one suit, and if any part is left out, a fresh suit for that part is barred.

2. Order IX Rule 9 of CPC: If a suit is dismissed for the plaintiff’s default (i.e., for non-appearance of the plaintiff), the plaintiff is precluded from bringing a fresh suit on the same cause of action. However, the plaintiff may apply for setting aside the dismissal if he can show sufficient cause.

3. Section 11 of CPC (Res Judicata): If a matter has been directly and substantially in issue in a former suit between the same parties and has been finally decided by a competent court, the plaintiff is precluded from bringing a fresh suit on the same issue.

Therefore, the plaintiff is precluded from bringing a fresh suit in the following situations:

- When he omits or relinquishes a part of his claim (Order II Rule 2).
- When the previous suit was dismissed for default of appearance (Order IX Rule 9).
- When the matter has already been finally decided between the same parties (Section 11, Res Judicata).

The correct option would be: The plaintiff is precluded from bringing a fresh suit when (a) he omits or relinquishes a part of his claim, (b) the previous suit was dismissed for default of appearance, or (c) the matter has already been finally decided between the same parties by a competent court.",Incorrect,
" How many times at max. may an adjournment be granted to a party during hearing of the suit as per the Code of Civil Procedure, 1908?","Options:
A. Two times
B. Three times
C. Four times
D. No limit prescribed",B,"As per the Code of Civil Procedure, 1908 (CPC), specifically under Order XVII Rule 1, the maximum number of adjournments that may be granted to a party during the hearing of the suit is three times. The statute clearly states that no party shall be granted more than three adjournments during the hearing of the suit, except in exceptional circumstances to be recorded in writing.

Therefore, the correct option is:
B. Three times.",Correct,
" Which of the following Amendment Act made the provision in the Code of Civil Procedure, 1908 to produce a witness without a summons?","Options:
A. The Code of Civil Procedure (Amendment) Act, 1976
B. The Code of Civil Procedure (Amendment) Act, 1999
C. The Code of Civil Procedure (Amendment) Act, 2002
D. Such provision does not exist.",A,"The provision to produce a witness without a summons was introduced by the Code of Civil Procedure (Amendment) Act, 1976. Therefore, the correct answer is A. The Code of Civil Procedure (Amendment) Act, 1976.",Correct,
" Which of the following is not included in the word costs as provided under the Code of Civil Procedure, 1908?","Options:
A. The expenses of the witnesses incurred.
B. Legal fees and expenses incurred.
C. Fooding and lodging expenses incurred.
D. Any other expenses incurred in connection with the proceedings.",C,"The term ""costs"" under the Code of Civil Procedure, 1908 (CPC) generally refers to the expenses that a party incurs in the course of litigation, which the court may order one party to pay to the other. According to Section 35 and related provisions of the CPC, ""costs"" typically include:

A. The expenses of the witnesses incurred – These are included as costs.
B. Legal fees and expenses incurred – These are included as costs.
C. Fooding and lodging expenses incurred – These are generally not included as costs under the CPC.
D. Any other expenses incurred in connection with the proceedings – These may be included as costs if the court deems them necessary and reasonable.

Therefore, the correct answer is:

C. Fooding and lodging expenses incurred.

These are not typically included in the word ""costs"" as provided under the Code of Civil Procedure, 1908.",Correct,
" What period is prescribed under the Code of Civil Procedure, 1908 for defendant to enter an appearance for filing address for service of notice on him in case of a suit where summary procedure is to be applied?","Options:
A. Seven days from the date of receiving of summons.
B. Ten days from the date of receiving of summons.
C. Fifteen days from the date of receiving of summons.
D. Thirty days from the date of receiving of summons.",B,"The period prescribed under the Code of Civil Procedure, 1908 for the defendant to enter an appearance and file an address for service of notice on him in case of a suit where summary procedure is to be applied is B. Ten days from the date of receiving of summons.",Correct,
